{
  "$schema": "./tokens.schema.json",
  "version": 1,
  "source": "src/ui/tokens.css",
  "color": {
    "light": {
      "brand-50": "#e8f4fb",
      "brand-100": "#cfe6f6",
      "brand-200": "#9fcdee",
      "brand-400": "#3caae5",
      "brand-500": "#0b4f94",
      "brand-600": "#083a6e",
      "brand-700": "#083a6e",
      "canvas": "#f4f8fb",
      "canvas-alt": "#edf5f9",
      "surface": "#ffffff",
      "ink": "#17324d",
      "ink-soft": "#5a6d80",
      "heading": "#083a6e",
      "link": "#0b4f94",
      "line": "#d9e5ee",
      "line-strong": "#c8dce9",
      "tile": "#eaf1f7",
      "field": "#f8fbfd",
      "table-head": "#f3f8fb",
      "row-hover": "#f2f8fc",
      "overlay": "rgb(18 59 92 / 50%)",
      "focus": "#2181bc",
      "plate": "#ffffff",
      "success": "#28745d",
      "success-soft": "#e6f4ef",
      "success-line": "#c4e3d8",
      "info": "#426c8a",
      "info-soft": "#eaf3f9",
      "info-line": "#cfe5f3",
      "warning": "#8a6727",
      "warning-soft": "#fff5df",
      "warning-line": "#f1dfb9",
      "danger": "#a13f46",
      "danger-soft": "#fbeceb",
      "danger-line": "#f0cfcd",
      "accent": "#c56d5c",
      "accent-strong": "#a8503f"
    },
    "dark": {
      "brand-50": "#10263f",
      "brand-100": "#163a5f",
      "brand-200": "#235688",
      "brand-400": "#3caae5",
      "brand-500": "#2b7fc9",
      "brand-600": "#5aaef0",
      "brand-700": "#9cd3f7",
      "canvas": "#0a1624",
      "canvas-alt": "#0d1c2d",
      "surface": "#112236",
      "ink": "#e6eef6",
      "ink-soft": "#9db0c3",
      "heading": "#9cd3f7",
      "link": "#5aaef0",
      "line": "#1f3550",
      "line-strong": "#2a4666",
      "tile": "#18304a",
      "field": "#0e1d2f",
      "table-head": "#152a42",
      "row-hover": "#162b43",
      "overlay": "rgb(2 8 16 / 65%)",
      "focus": "#5aaef0",
      "success": "#7fd3b4",
      "success-soft": "#10302b",
      "success-line": "#1d4d43",
      "info": "#9cc4e0",
      "info-soft": "#132c45",
      "info-line": "#1f4468",
      "warning": "#e6c27a",
      "warning-soft": "#33290f",
      "warning-line": "#55421a",
      "danger": "#f0a3a8",
      "danger-soft": "#3a1a20",
      "danger-line": "#5e2a32",
      "accent": "#d98a7a",
      "accent-strong": "#b5594a"
    }
  },
  "radius": {
    "field": "9px",
    "control": "10px",
    "tile": "12px",
    "card": "14px",
    "modal": "20px",
    "hero": "24px",
    "pill": "999px"
  },
  "shadow": {
    "card": "0 5px 18px rgb(18 61 99 / 6%)",
    "pop": "0 30px 100px rgb(18 43 70 / 25%)"
  },
  "text": {
    "eyebrow": "10px",
    "micro": "11px",
    "label": "12px",
    "small": "13px",
    "body": "14px",
    "body-lg": "15px",
    "section": "16px",
    "subtitle": "20px",
    "title": "25px",
    "metric": "27px",
    "page": "30px"
  },
  "space": {
    "1": "4px",
    "2": "8px",
    "3": "12px",
    "4": "16px",
    "5": "20px",
    "6": "24px"
  },
  "layout": {
    "sidebar-w": "232px",
    "sidebar-w-narrow": "208px",
    "topbar-h": "60px",
    "topbar-h-wide": "64px",
    "content-pad-x": "28px",
    "content-pad-y": "24px",
    "content-max": "1640px",
    "aside-w": "360px",
    "touch-min": "44px"
  },
  "breakpoint": {
    "wide": "100rem"
  },
  "z": {
    "sticky": "5",
    "topbar": "30",
    "drawer": "50",
    "modal": "55",
    "toast": "60"
  },
  "font": {
    "family-ui": "\"Be Vietnam Pro\""
  }
}
